{"artifact_hash":"21df33d5afc2fac8f66a3aa9d8834953f10441bdf96ca157663a3d8968863ed9","boundary":"QUALIFIED-POOL-ONLY — NOT REGISTERED (order §14: registration closed)","candidate_id":"ECP-CAND-000001","content_class":"format-illustration","content_hash":"d93ee1810e1a63a07e6a6446b988e5289a85beda959b83b589a9b0cf918d0004","decision":"ACCEPT","dimensions":{"environmental_pre_check":{"findings":[],"status":"PRESENT"},"ground_truth":{"authored_class":"DERIVABLE","derived_class":"DERIVABLE","findings":[],"status":"PASS","verification":{"derived_class":"DERIVABLE","method":"propositional-truth-table-statement","model_count":1,"trace":[{"model_count":1,"total_assignments":8}],"value":null}},"identity":{"canonicalization":"ECP-CANONICAL-JSON-1.0","content_hash_verified":true,"status":"PASS"},"independence":{"findings":[],"status":"COMPLETE"},"leakage":{"classes":{"direct_answer":"CLEAR","fixture":"CLEAR","implementation_encoding":"CLEAR","model":"NOT-APPLICABLE-PRE-EXECUTION (FORMAT ILLUSTRATION: public dummy values; no real qualification is implied)","semantic_answer":"CLEAR","solution_trajectory":"CLEAR"},"findings":[],"status":"CLEAN"},"novelty":{"findings":[],"n1_direct_retrieval":"OPEN-QUESTION (illustration)","n2_solution_retrieval":"OPEN-QUESTION (illustration)","n3_within_pool":"UNIQUE","n4_cross_population":{"basis":"illustration","status":"CLEAR"},"n5_implementation_encoding":"CLEAR","n6_fixture_leakage":"CLEAR","skeleton":"5cd472839afdd9aa7152dddc66147c504f48164cb341a80310effef5e2a2fa4b","status":"UNIQUE"},"representation_bias":{"findings":[],"status":"PRESENT"},"structural":{"findings":[],"status":"PASS"}},"ecp_object":"case-qualification","engine":{"id":"ECP-QUALIFICATION-ENGINE-1","version":"0.5.0"},"entry_index":1,"forwarded":[],"operator":"ECP Foundation Executor <foundation@ecp-protocol.local>","prev_qualification_hash":"0000000000000000000000000000000000000000000000000000000000000000","protocol_version":"0.5.0","qualification_id":"ECP-QUAL-900001","qualified_at":"2026-09-09T00:00:00Z","reason_codes":[],"run_id":"ECP-QUALRUN-EXAMPLE","schema_version":"0.5.0","source_case_id":"S-001"}